<?xml version="1.0" encoding="UTF-8"?>
<!DOCTYPE architecture SYSTEM "architecture.dtd">

<architecture>

    <classifier id="mlp">
        <type>MLP</type>
        <param name="learnrate">0.1</param>
        <param name="maxepochs">3000</param>
        <param name="splitratio">0.9</param>
        <param name="learningmonitor">
            <learningmonitor>
                <type>DecreaseRatio</type>
                <param name="ratio">0.2</param>
                <param name="windowsize">5</param>
            </learningmonitor>
        </param>
        <param name="errorcalculator">LogLikelihood</param>
    </classifier>

        
    <classifier id="main" ref="mlp">
        <inputtransform>bagofwords</inputtransform>
        <outputtransform>counter</outputtransform>
    </classifier>
</architecture>

