<?xml version="1.0" encoding="UTF-8"?>
<!DOCTYPE architecture SYSTEM "architecture.dtd">

<architecture>
    
  
    <classifier id="svm">
        <type>LibLinear</type>
        <param name="c">10</param>
    </classifier>

   
    <classifier id="hier">
        <type>Hierarchic</type>
        <param name="root">
            <classifier ref="svm" />
        </param>
        <param name="child">
            <classifier ref="svm">
                <inputtransform>compress</inputtransform>
                <outputtransform>counter</outputtransform>
            </classifier>
        </param>
        <param name="childselector">
            <converter>
                <type>Interval</type>
                <param name="file">code_chapters.txt</param>
            </converter>
        </param>
    </classifier>
    
    <classifier id="main" ref="hier">
        <inputtransform>bagofwords</inputtransform>
    </classifier>
</architecture>

